URL,Version,Status,OIDs,Name,Title,Descriptino,Uses,Used,Sources
http://hl7.org/fhir/ValueSet/address-type,4.0.1,active,"2.16.840.1.113883.4.642.3.69",AddressType,AddressType,"The type of an address (physical / postal).","StructureDefinition/PatientLE,StructureDefinition/OrganizationLE","hl7.fhir.r4.core"
http://hl7.org/fhir/ValueSet/address-use,4.0.1,active,"2.16.840.1.113883.4.642.3.67",AddressUse,AddressUse,"The use of an address.","StructureDefinition/PatientLE,StructureDefinition/OrganizationLE","hl7.fhir.r4.core"
http://hl7.org/fhir/ValueSet/administrative-gender,4.0.1,active,"2.16.840.1.113883.4.642.3.1",AdministrativeGender,AdministrativeGender,"The gender of a person used for administrative purposes.","StructureDefinition/PrestadorProfesionalLE,StructureDefinition/PrestadorAdministrativoLE,StructureDefinition/PatientLE,StructureDefinition/SexoBiologico","hl7.fhir.r4.core"
http://hl7.org/fhir/ValueSet/allergy-intolerance-category,4.0.1,draft,"2.16.840.1.113883.4.642.3.133",AllergyIntoleranceCategory,AllergyIntoleranceCategory,"Category of an identified substance associated with allergies or intolerances.","StructureDefinition/AllergyIntoleranceInicioLE","hl7.fhir.r4.core"
http://hl7.org/fhir/ValueSet/allergy-intolerance-criticality,4.0.1,draft,"2.16.840.1.113883.4.642.3.129",AllergyIntoleranceCriticality,AllergyIntoleranceCriticality,"Estimate of the potential clinical harm, or seriousness, of a reaction to an identified substance.","StructureDefinition/AllergyIntoleranceInicioLE","hl7.fhir.r4.core"
http://hl7.org/fhir/ValueSet/allergy-intolerance-type,4.0.1,draft,"2.16.840.1.113883.4.642.3.131",AllergyIntoleranceType,AllergyIntoleranceType,"Identification of the underlying physiological mechanism for a Reaction Risk.","StructureDefinition/AllergyIntoleranceInicioLE","hl7.fhir.r4.core"
http://hl7.org/fhir/ValueSet/allergyintolerance-clinical,4.0.1,draft,"2.16.840.1.113883.4.642.3.1372",AllergyIntoleranceClinicalStatusCodes,AllergyIntolerance Clinical Status Codes,"Preferred value set for AllergyIntolerance Clinical Status.","StructureDefinition/AllergyIntoleranceInicioLE","THO"
http://hl7.org/fhir/ValueSet/allergyintolerance-code,4.0.1,draft,"2.16.840.1.113883.4.642.3.137",AllergyIntoleranceSubstance/Product,ConditionAndNegationCodes,AllergyIntolerance Substance/Product, Condition and Negation Codes,"This value set includes concept codes for specific substances/pharmaceutical products, allergy or intolerance conditions, and negation/exclusion codes to specify the absence of specific types of allergies or intolerances.","StructureDefinition/AllergyIntoleranceInicioLE","SCT"
http://hl7.org/fhir/ValueSet/allergyintolerance-verification,4.0.1,draft,"2.16.840.1.113883.4.642.3.1370",AllergyIntoleranceVerificationStatusCodes,AllergyIntolerance Verification Status Codes,"Preferred value set for AllergyIntolerance Verification Status.","StructureDefinition/AllergyIntoleranceInicioLE","THO"
http://hl7.org/fhir/ValueSet/appointment-cancellation-reason,4.0.1,draft,"2.16.840.1.113883.4.642.3.1381",AppointmentCancellationReason,Appointment cancellation reason,"This example value set defines a set of reasons for the cancellation of an appointment.","StructureDefinition/AppointmentAgendarLE","THO"
http://hl7.org/fhir/ValueSet/appointmentstatus,4.0.1,draft,"2.16.840.1.113883.4.642.3.484",AppointmentStatus,AppointmentStatus,"The free/busy status of an appointment.","StructureDefinition/AppointmentAgendarLE","hl7.fhir.r4.core"
http://hl7.org/fhir/ValueSet/body-site,4.0.1,draft,"2.16.840.1.113883.4.642.3.141",SNOMEDCTBodyStructures,SNOMED CT Body Structures,"This value set includes all codes from [SNOMED CT](http://snomed.info/sct) where concept is-a 442083009 (Anatomical or acquired body site (body structure)).","StructureDefinition/ObservationInicioIndiceComorbilidadLE,StructureDefinition/ConditionInicioDiagnosticoLE,StructureDefinition/ObservationInicioCuidadorLE,StructureDefinition/ServiceRequestLE,StructureDefinition/ObservationAtenderLE,StructureDefinition/ObservationInicioLE,StructureDefinition/ObservationInicioDiscapacidadLE,StructureDefinition/ConditionInicioGesLE,StructureDefinition/ServiceRequestExamenLE","SCT"
http://hl7.org/fhir/ValueSet/bundle-type,4.0.1,active,"2.16.840.1.113883.4.642.3.620",BundleType,BundleType,"Indicates the purpose of a bundle - how it is intended to be used.","StructureDefinition/BundleReferenciaLE,StructureDefinition/BundleRevisarLE,StructureDefinition/BundleAtenderLE,StructureDefinition/BundlePriorizarLE,StructureDefinition/BundleInicioLE,StructureDefinition/BundleAgendarLE,StructureDefinition/BundleTerminarLE","hl7.fhir.r4.core"
http://hl7.org/fhir/ValueSet/c80-facilitycodes,4.0.1,active,"2.16.840.1.113883.3.88.12.80.67",FacilityTypeCodeValueSet,Facility Type Code Value Set,"This is the code representing the type of organizational setting where the clinical encounter, service, interaction, or treatment occurred. The value set used for Healthcare Facility Type has been defined by HITSP to be the value set reproduced from HITSP C80 Table 2-147.","StructureDefinition/DocumentReferenceInicioLE","SCT"
http://hl7.org/fhir/ValueSet/c80-practice-codes,4.0.1,active,"2.16.840.1.113883.3.88.12.80.72",PracticeSettingCodeValueSet,Practice Setting Code Value Set,"This is the code representing the clinical specialty of the clinician or provider who interacted with, treated, or provided a service to/for the patient. The value set used for clinical specialty has been limited by HITSP to the value set reproduced from HITSP C80 Table 2-149 Clinical Specialty Value Set Definition.","StructureDefinition/PractitionerRoleLE,StructureDefinition/AppointmentAgendarLE,StructureDefinition/DocumentReferenceInicioLE","SCT"
http://hl7.org/fhir/ValueSet/care-plan-activity-kind,4.0.1,draft,"2.16.840.1.113883.4.642.3.145",CarePlanActivityKind,Care Plan Activity Kind,"Resource types defined as part of FHIR that can be represented as in-line definitions of a care plan activity.","StructureDefinition/CarePlanAtenderLE","hl7.fhir.r4.core"
http://hl7.org/fhir/ValueSet/care-plan-activity-outcome,4.0.1,draft,"2.16.840.1.113883.4.642.3.149",CarePlanActivityOutcome,Care Plan Activity Outcome,"Example codes indicating the outcome of a care plan activity. Note that these are in no way complete and might not even be appropriate for some uses.","StructureDefinition/CarePlanAtenderLE","SCT"
http://hl7.org/fhir/ValueSet/care-plan-activity-status,4.0.1,draft,"2.16.840.1.113883.4.642.3.146",CarePlanActivityStatus,CarePlanActivityStatus,"Codes that reflect the current state of a care plan activity within its overall life cycle.","StructureDefinition/CarePlanAtenderLE","hl7.fhir.r4.core"
http://hl7.org/fhir/ValueSet/care-plan-category,4.0.1,draft,"2.16.840.1.113883.4.642.3.148",CarePlanCategory,Care Plan Category,"Example codes indicating the category a care plan falls within.  Note that these are in no way complete and might not even be appropriate for some uses.","StructureDefinition/CarePlanAtenderLE","SCT"
http://hl7.org/fhir/ValueSet/care-plan-intent,4.0.1,draft,"2.16.840.1.113883.4.642.3.150",CarePlanIntent,Care Plan Intent,"Codes indicating the degree of authority/intentionality associated with a care plan.","StructureDefinition/CarePlanAtenderLE","hl7.fhir.r4.core"
http://hl7.org/fhir/ValueSet/clinical-findings,4.0.1,draft,"2.16.840.1.113883.4.642.3.232",SNOMEDCTClinicalFindings,SNOMED CT Clinical Findings,"This value set includes all the ""Clinical finding"" [SNOMED CT](http://snomed.info/sct) codes - concepts where concept is-a 404684003 (Clinical finding (finding)).","StructureDefinition/CarePlanAtenderLE,StructureDefinition/AllergyIntoleranceInicioLE","SCT"
http://hl7.org/fhir/ValueSet/common-tags,4.0.1,draft,"2.16.840.1.113883.4.642.3.79",CommonTags,Common Tags,"Common Tag Codes defined by FHIR project","StructureDefinition/MessageHeaderLE","THO"
http://hl7.org/fhir/ValueSet/composition-status,4.0.1,draft,"2.16.840.1.113883.4.642.3.241",CompositionStatus,CompositionStatus,"The workflow/clinical status of the composition.","StructureDefinition/DocumentReferenceInicioLE","hl7.fhir.r4.core"
http://hl7.org/fhir/ValueSet/condition-category,4.0.1,draft,"2.16.840.1.113883.4.642.3.162",ConditionCategoryCodes,Condition Category Codes,"Preferred value set for Condition Categories.","StructureDefinition/ConditionInicioDiagnosticoLE,StructureDefinition/ConditionInicioGesLE","THO"
http://hl7.org/fhir/ValueSet/condition-clinical,4.0.1,draft,"2.16.840.1.113883.4.642.3.164",ConditionClinicalStatusCodes,Condition Clinical Status Codes,"Preferred value set for Condition Clinical Status.","StructureDefinition/ConditionInicioDiagnosticoLE,StructureDefinition/ConditionInicioGesLE","THO"
http://hl7.org/fhir/ValueSet/condition-code,4.0.1,draft,"2.16.840.1.113883.4.642.3.161",Condition/Problem/DiagnosisCodes,Condition/Problem/Diagnosis Codes,"Example value set for Condition/Problem/Diagnosis codes.","StructureDefinition/ConditionInicioDiagnosticoLE","SCT"
http://hl7.org/fhir/ValueSet/condition-severity,4.0.1,draft,"2.16.840.1.113883.4.642.3.168",Condition/DiagnosisSeverity,Condition/Diagnosis Severity,"Preferred value set for Condition/Diagnosis severity grading.","StructureDefinition/ConditionInicioDiagnosticoLE,StructureDefinition/ConditionInicioGesLE","SCT"
http://hl7.org/fhir/ValueSet/condition-stage,4.0.1,draft,"2.16.840.1.113883.4.642.3.170",ConditionStage,Condition Stage,"Example value set for stages of cancer and other conditions.","StructureDefinition/ConditionInicioDiagnosticoLE,StructureDefinition/ConditionInicioGesLE","SCT"
http://hl7.org/fhir/ValueSet/condition-stage-type,4.0.1,draft,"2.16.840.1.113883.4.642.3.171",ConditionStageType,Condition Stage Type,"Example value set for the type of stages of cancer and other conditions","StructureDefinition/ConditionInicioDiagnosticoLE,StructureDefinition/ConditionInicioGesLE","SCT"
http://hl7.org/fhir/ValueSet/condition-ver-status,4.0.1,draft,"2.16.840.1.113883.4.642.3.166",ConditionVerificationStatus,ConditionVerificationStatus,"The verification status to support or decline the clinical status of the condition or diagnosis.","StructureDefinition/ConditionInicioDiagnosticoLE,StructureDefinition/ConditionInicioGesLE","THO"
http://hl7.org/fhir/ValueSet/contact-point-system,4.0.1,active,"2.16.840.1.113883.4.642.3.71",ContactPointSystem,ContactPointSystem,"Telecommunications form for contact point.","StructureDefinition/PrestadorProfesionalLE,StructureDefinition/PrestadorAdministrativoLE,StructureDefinition/PatientLE,StructureDefinition/OrganizationLE","hl7.fhir.r4.core"
http://hl7.org/fhir/ValueSet/contact-point-use,4.0.1,active,"2.16.840.1.113883.4.642.3.73",ContactPointUse,ContactPointUse,"Use of contact point.","StructureDefinition/PrestadorProfesionalLE,StructureDefinition/PrestadorAdministrativoLE,StructureDefinition/PatientLE,StructureDefinition/OrganizationLE","hl7.fhir.r4.core"
http://hl7.org/fhir/ValueSet/contactentity-type,4.0.1,draft,"2.16.840.1.113883.4.642.3.416",ContactEntityType,Contact entity type,"This example value set defines a set of codes that can be used to indicate the purpose for which you would contact a contact party.","StructureDefinition/OrganizationLE","THO"
http://hl7.org/fhir/ValueSet/coverage-copay-type,4.0.1,draft,"2.16.840.1.113883.4.642.3.527",CoverageCopayTypeCodes,Coverage Copay Type Codes,"This value set includes sample Coverage Copayment Type codes.","StructureDefinition/CoverageInicioLE","THO"
http://hl7.org/fhir/ValueSet/coverage-financial-exception,4.0.1,draft,"2.16.840.1.113883.4.642.3.1328",ExampleCoverageFinancialExceptionCodes,Example Coverage Financial Exception Codes,"This value set includes Example Coverage Financial Exception Codes.","StructureDefinition/CoverageInicioLE","THO"
http://hl7.org/fhir/ValueSet/coverage-type,4.0.1,draft,"2.16.840.1.113883.4.642.3.520",CoverageTypeAndSelf-PayCodes,Coverage Type and Self-Pay Codes,"This value set includes Coverage Type codes.","StructureDefinition/CoverageInicioLE","THO"
http://hl7.org/fhir/ValueSet/data-absent-reason,4.0.1,active,"2.16.840.1.113883.4.642.3.5",DataAbsentReason,DataAbsentReason,"Used to specify why the normally expected content of the data element is missing.","StructureDefinition/ObservationInicioIndiceComorbilidadLE,StructureDefinition/ObservationInicioCuidadorLE,StructureDefinition/ObservationAtenderLE,StructureDefinition/ObservationInicioLE,StructureDefinition/ObservationInicioDiscapacidadLE","THO"
http://hl7.org/fhir/ValueSet/days-of-week,4.0.1,active,"2.16.840.1.113883.4.642.3.512",DaysOfWeek,DaysOfWeek,"The days of the week.","StructureDefinition/PractitionerRoleLE","hl7.fhir.r4.core"
http://hl7.org/fhir/ValueSet/diagnosis-role,4.0.1,draft,"2.16.840.1.113883.4.642.3.49",DiagnosisRole,DiagnosisRole,"This value set defines a set of codes that can be used to express the role of a diagnosis on the Encounter or EpisodeOfCare record.","StructureDefinition/EncounterAtenderLE,StructureDefinition/EncounterInicioLE","THO"
http://hl7.org/fhir/ValueSet/document-classcodes,4.0.1,active,"2.16.840.1.113883.3.88.12.80.46",DocumentClassValueSet,Document Class Value Set,"This is the code specifying the high-level kind of document (e.g. Prescription, Discharge Summary, Report, etc.). Note: Class code for documents comes from LOINC, and is based upon one of the following:The type of service described by the document. It is described at a very high level in Section 7.3 of the LOINC Manual. The type study performed. It was determined by identifying modalities for study reports. The section of the chart where the document is placed. It was determined from the SETs created for Claims Attachment requests.","StructureDefinition/DocumentReferenceInicioLE","LOINC"
http://hl7.org/fhir/ValueSet/document-reference-status,4.0.1,draft,"2.16.840.1.113883.4.642.3.7",DocumentReferenceStatus,DocumentReferenceStatus,"The status of the document reference.","StructureDefinition/DocumentReferenceInicioLE","hl7.fhir.r4.core"
http://hl7.org/fhir/ValueSet/document-relationship-type,4.0.1,draft,"2.16.840.1.113883.4.642.3.244",DocumentRelationshipType,DocumentRelationshipType,"The type of relationship between documents.","StructureDefinition/DocumentReferenceInicioLE","hl7.fhir.r4.core"
http://hl7.org/fhir/ValueSet/encounter-admit-source,4.0.1,draft,"2.16.840.1.113883.4.642.3.257",AdmitSource,Admit source,"This value set defines a set of codes that can be used to indicate from where the patient came in.","StructureDefinition/EncounterAtenderLE,StructureDefinition/EncounterInicioLE","THO"
http://hl7.org/fhir/ValueSet/encounter-diet,4.0.1,draft,"2.16.840.1.113883.4.642.3.255",Diet,Diet,"This value set defines a set of codes that can be used to indicate dietary preferences or restrictions a patient may have.","StructureDefinition/EncounterAtenderLE,StructureDefinition/EncounterInicioLE","THO"
http://hl7.org/fhir/ValueSet/encounter-discharge-disposition,4.0.1,draft,"2.16.840.1.113883.4.642.3.259",DischargeDisposition,Discharge disposition,"This value set defines a set of codes that can be used to where the patient left the hospital.","StructureDefinition/EncounterAtenderLE,StructureDefinition/EncounterInicioLE","THO"
http://hl7.org/fhir/ValueSet/encounter-location-status,4.0.1,draft,"2.16.840.1.113883.4.642.3.262",EncounterLocationStatus,EncounterLocationStatus,"The status of the location.","StructureDefinition/EncounterAtenderLE,StructureDefinition/EncounterInicioLE","hl7.fhir.r4.core"
http://hl7.org/fhir/ValueSet/encounter-participant-type,4.0.1,draft,"2.16.840.1.113883.4.642.3.250",ParticipantType,Participant type,"This value set defines a set of codes that can be used to indicate how an individual participates in an encounter.","StructureDefinition/AppointmentAgendarLE,StructureDefinition/EncounterAtenderLE,StructureDefinition/EncounterInicioLE","THO (V3),THO"
http://hl7.org/fhir/ValueSet/encounter-reason,4.0.1,draft,"2.16.840.1.113883.4.642.3.261",EncounterReasonCodes,Encounter Reason Codes,"This examples value set defines the set of codes that can be used to indicate reasons for an encounter.","StructureDefinition/AppointmentAgendarLE,StructureDefinition/EncounterAtenderLE,StructureDefinition/EncounterInicioLE","SCT"
http://hl7.org/fhir/ValueSet/encounter-special-arrangements,4.0.1,draft,"2.16.840.1.113883.4.642.3.253",SpecialArrangements,Special arrangements,"This value set defines a set of codes that can be used to indicate the kinds of special arrangements in place for a patients visit.","StructureDefinition/EncounterAtenderLE,StructureDefinition/EncounterInicioLE","THO"
http://hl7.org/fhir/ValueSet/encounter-special-courtesy,4.0.1,draft,"2.16.840.1.113883.4.642.3.252",SpecialCourtesy,Special courtesy,"This value set defines a set of codes that can be used to indicate special courtesies provided to the patient.","StructureDefinition/EncounterAtenderLE,StructureDefinition/EncounterInicioLE","THO (V3)"
http://hl7.org/fhir/ValueSet/encounter-status,4.0.1,draft,"2.16.840.1.113883.4.642.3.246",EncounterStatus,EncounterStatus,"Current state of the encounter.","StructureDefinition/EncounterAtenderLE,StructureDefinition/EncounterInicioLE","hl7.fhir.r4.core"
http://hl7.org/fhir/ValueSet/encounter-type,4.0.1,draft,"2.16.840.1.113883.4.642.3.248",EncounterType,Encounter type,"This example value set defines a set of codes that can be used to indicate the type of encounter: a specific code indicating type of service provided.","StructureDefinition/EncounterInicioLE","THO"
http://hl7.org/fhir/ValueSet/fm-status,4.0.1,draft,"2.16.840.1.113883.4.642.3.592",FinancialResourceStatusCodes,Financial Resource Status Codes,"This value set includes Status codes.","StructureDefinition/CoverageInicioLE","hl7.fhir.r4.core"
http://hl7.org/fhir/ValueSet/formatcodes,4.0.1,active,"1.3.6.1.4.1.19376.1.2.7.1",DocumentReferenceFormatCodeSet,DocumentReference Format Code Set,"The value set is defined to be the set of format codes defined by the IHE Technical Framework, and also including additional format codes defined by the    HL7. The value set is listed in HITSP C80 Table 2-153 Format Code Value Set Definition,    with additions published later by IHE as published    at http://wiki.ihe.net/index.php?title=IHE_Format_Codes   and with additions published later by HL7 as published at https://confluence.hl7.org/display/SD/Format+Codes+for+IHE+XDS.   This is the code specifying the technical format of the document. Along with the typeCode,    it should provide sufficient information to allow any potential document consumer to know    if it will be able to process the document. The code shall be sufficiently specific to    ensure processing/display by identifying a document encoding, structure and template. The actual list of codes here is incomplete","StructureDefinition/DocumentReferenceInicioLE","Other"
http://hl7.org/fhir/ValueSet/http-verb,4.0.1,active,"2.16.840.1.113883.4.642.3.624",HTTPVerb,HTTPVerb,"HTTP verbs (in the HTTP command line). See [HTTP rfc](https://tools.ietf.org/html/rfc7231) for details.","StructureDefinition/BundleReferenciaLE,StructureDefinition/BundleRevisarLE,StructureDefinition/BundleAtenderLE,StructureDefinition/BundlePriorizarLE,StructureDefinition/BundleInicioLE,StructureDefinition/BundleAgendarLE,StructureDefinition/BundleTerminarLE","hl7.fhir.r4.core"
http://hl7.org/fhir/ValueSet/identifier-type,4.0.1,active,"2.16.840.1.113883.4.642.3.45",Identifier Type Codes,IdentifierType,"A coded type for an identifier that can be used to determine which identifier to use for a specific purpose.","StructureDefinition/PrestadorProfesionalLE,StructureDefinition/PrestadorAdministrativoLE,StructureDefinition/ServiceRequestLE,StructureDefinition/OrganizationLE,StructureDefinition/AppointmentAgendarLE,StructureDefinition/EncounterAtenderLE,StructureDefinition/ServiceRequestExamenLE,StructureDefinition/EncounterInicioLE","THO (V2)"
http://hl7.org/fhir/ValueSet/identifier-use,4.0.1,active,"2.16.840.1.113883.4.642.3.57",IdentifierUse,IdentifierUse,"Identifies the purpose for this identifier, if known .","StructureDefinition/PrestadorProfesionalLE,StructureDefinition/PrestadorAdministrativoLE,StructureDefinition/PatientLE,StructureDefinition/ServiceRequestLE,StructureDefinition/OrganizationLE,StructureDefinition/AppointmentAgendarLE,StructureDefinition/EncounterAtenderLE,StructureDefinition/ServiceRequestExamenLE,StructureDefinition/EncounterInicioLE","hl7.fhir.r4.core"
http://hl7.org/fhir/ValueSet/languages,4.0.1,draft,"2.16.840.1.113883.4.642.3.20",CommonLanguages,Common Languages,"This value set includes common codes from BCP-47 (http://tools.ietf.org/html/bcp47)","StructureDefinition/CarePlanAtenderLE,StructureDefinition/ObservationAtenderLE,StructureDefinition/ObservationInicioDiscapacidadLE,StructureDefinition/MessageHeaderLE,StructureDefinition/BundlePriorizarLE,StructureDefinition/BundleInicioLE,StructureDefinition/BundleAgendarLE,StructureDefinition/QuestionnaireResponseAtenderLE,StructureDefinition/BundleTerminarLE,StructureDefinition/PrestadorAdministrativoLE,StructureDefinition/PractitionerRoleLE,StructureDefinition/BundleRevisarLE,StructureDefinition/AllergyIntoleranceInicioLE,StructureDefinition/AppointmentAgendarLE,StructureDefinition/EncounterInicioLE,StructureDefinition/PrestadorProfesionalLE,StructureDefinition/ConditionInicioDiagnosticoLE,StructureDefinition/OrganizationLE,StructureDefinition/BundleAtenderLE,StructureDefinition/ConditionInicioGesLE,StructureDefinition/DocumentReferenceInicioLE,StructureDefinition/ServiceRequestExamenLE,StructureDefinition/ObservationInicioIndiceComorbilidadLE,StructureDefinition/PatientLE,StructureDefinition/BundleReferenciaLE,StructureDefinition/ObservationInicioCuidadorLE,StructureDefinition/ServiceRequestLE,StructureDefinition/ObservationInicioLE,StructureDefinition/EncounterAtenderLE,StructureDefinition/QuestionnaireResponseInicioLE,StructureDefinition/CoverageInicioLE","hl7.terminology.r4"
http://hl7.org/fhir/ValueSet/link-type,4.0.1,active,"2.16.840.1.113883.4.642.3.423",LinkType,LinkType,"The type of link between this patient resource and another patient resource.","StructureDefinition/PatientLE","hl7.fhir.r4.core"
http://hl7.org/fhir/ValueSet/location-physical-type,4.0.1,draft,"2.16.840.1.113883.4.642.3.328",LocationType,Location type,"This example value set defines a set of codes that can be used to indicate the physical form of the Location.","StructureDefinition/EncounterAtenderLE,StructureDefinition/EncounterInicioLE","THO"
http://hl7.org/fhir/ValueSet/manifestation-or-symptom,4.0.1,draft,"2.16.840.1.113883.4.642.3.169",ManifestationAndSymptomCodes,Manifestation and Symptom Codes,"Example value set for Manifestation and Symptom codes.","StructureDefinition/ConditionInicioDiagnosticoLE,StructureDefinition/ConditionInicioGesLE","SCT"
http://hl7.org/fhir/ValueSet/medication-as-needed-reason,4.0.1,draft,"2.16.840.1.113883.4.642.3.96",SNOMEDCTMedicationAsNeededReasonCodes,SNOMED CT Medication As Needed Reason Codes,"This value set includes all clinical findings from SNOMED CT - provided as an exemplar value set.","StructureDefinition/ServiceRequestLE,StructureDefinition/ServiceRequestExamenLE","SCT"
http://hl7.org/fhir/ValueSet/medication-codes,4.0.1,draft,"2.16.840.1.113883.4.642.3.375",SNOMEDCTMedicationCodes,SNOMED CT Medication Codes,"This value set includes all drug or medicament substance codes and all pharmaceutical/biologic products from SNOMED CT - provided as an exemplar value set.","StructureDefinition/CarePlanAtenderLE","SCT"
http://hl7.org/fhir/ValueSet/message-events,4.0.1,active,"2.16.840.1.113883.4.642.3.26",MessageEvent,MessageEvent,"One of the message events defined as part of this version of FHIR.","StructureDefinition/MessageHeaderLE","hl7.fhir.r4.core"
http://hl7.org/fhir/ValueSet/message-reason-encounter,4.0.1,draft,"2.16.840.1.113883.4.642.3.378",ExampleMessageReasonCodes,Example Message Reason Codes,"Example Message Reasons. These are the set of codes that might be used an updating an encounter using admin-update.","StructureDefinition/MessageHeaderLE","THO"
http://hl7.org/fhir/ValueSet/mimetypes,4.0.1,active,"2.16.840.1.113883.4.642.3.1024",Mime Types,MimeType,"This value set includes all possible codes from BCP-13 (http://tools.ietf.org/html/bcp13)","StructureDefinition/DocumentReferenceInicioLE","Other"
http://hl7.org/fhir/ValueSet/name-use,4.0.1,active,"2.16.840.1.113883.4.642.3.65",NameUse,NameUse,"The use of a human name.","StructureDefinition/PrestadorProfesionalLE,StructureDefinition/PrestadorAdministrativoLE,StructureDefinition/PatientLE","hl7.fhir.r4.core"
http://hl7.org/fhir/ValueSet/observation-category,4.0.1,draft,"2.16.840.1.113883.4.642.3.403",ObservationCategoryCodes,Observation Category Codes,"Observation Category codes.","StructureDefinition/ObservationInicioIndiceComorbilidadLE,StructureDefinition/ObservationInicioCuidadorLE,StructureDefinition/ObservationAtenderLE,StructureDefinition/ObservationInicioLE,StructureDefinition/ObservationInicioDiscapacidadLE","THO"
http://hl7.org/fhir/ValueSet/observation-codes,4.0.1,draft,"2.16.840.1.113883.4.642.3.396",LOINCCodes,LOINC Codes,"This value set includes all LOINC codes","StructureDefinition/ObservationInicioIndiceComorbilidadLE,StructureDefinition/ObservationInicioCuidadorLE,StructureDefinition/ObservationAtenderLE,StructureDefinition/ObservationInicioLE,StructureDefinition/ObservationInicioDiscapacidadLE","LOINC"
